<assembly xmlns:xsi="http://www.w3.org/2001/XMLSchema-instance"
 xsi:noNamespaceSchemaLocation="assembly.xsd">
  <id>executable-jar-with-dependencies</id>
  <formats>
    <format>jar</format>
  </formats>
  <includeBaseDirectory>false</includeBaseDirectory>
  <dependencySets>
    <dependencySet>
      <!-- unpack les dÃ©pendances avant de les inclures dans le jar final de l'application -->
      <unpack>true</unpack>
      <scope>runtime</scope>
      <useProjectArtifact>false</useProjectArtifact>
    </dependencySet>
  </dependencySets>
  <fileSets>
    <fileSet>
      <directory>${project.build.outputDirectory}</directory>
      <outputDirectory></outputDirectory>
    </fileSet>
  </fileSets>
</assembly>